,facet,stem_text,drift_flag,readability_flag,length_flag,anchor,cosine_similarity,lenght_flag
727,Collaboration,I contribute to group activities to meet shared targets.,0,0,0,I cooperate toward shared goals.,0.7627429,0
728,Collaboration,I help others in reaching our common goals.,0,0,0,I cooperate toward shared goals.,0.80981874,0
729,Collaboration,I engage with others to reach collective objectives.,0,0,0,I cooperate toward shared goals.,0.81075865,0
730,Collaboration,I take part in group work to achieve the same goals.,1,0,0,I cooperate toward shared goals.,0.7327211,0
731,Collaboration,I combine efforts with others to reach our aims.,0,0,0,I cooperate toward shared goals.,0.7500185,0
732,Collaboration,I assist my team in achieving joint goals.,0,0,0,I cooperate toward shared goals.,0.79907566,0
733,Collaboration,I unite with others to accomplish shared aims.,0,0,0,I cooperate toward shared goals.,0.8218037,0
734,Collaboration,I support others in achieving our mutual objectives.,0,0,0,I cooperate toward shared goals.,0.82657856,0
735,Collaboration,I partner with others to fulfill common goals.,0,0,0,I cooperate toward shared goals.,0.82445616,0
736,Collaboration,I share efforts with my team to meet our objectives.,0,0,0,I cooperate toward shared goals.,0.79372394,0
737,Collaboration,I involve myself in teamwork to reach our goals.,0,0,0,I cooperate toward shared goals.,0.7612977,0
738,Collaboration,I work with others to achieve common targets.,0,0,0,I cooperate toward shared goals.,0.8365529,0
739,Collaboration,I team up with my group to accomplish our aims.,0,0,0,I cooperate toward shared goals.,0.7700518,0
740,Collaboration,I participate in joint efforts to reach shared goals.,0,0,0,I cooperate toward shared goals.,0.91621494,0
741,Collaboration,I cooperate with my team to achieve mutual objectives.,0,0,0,I cooperate toward shared goals.,0.86729616,0
742,Collaboration,I collaborate with others to reach common targets.,0,0,0,I cooperate toward shared goals.,0.8668539,0
743,Collaboration,I work alongside others to fulfill shared goals.,0,0,0,I cooperate toward shared goals.,0.8649025,0
744,Collaboration,I engage in group activities to achieve our aims.,1,0,0,I cooperate toward shared goals.,0.7307424,0
745,Collaboration,I contribute to teamwork to meet our objectives.,1,0,0,I cooperate toward shared goals.,0.74734926,0
746,Collaboration,I combine my efforts with others to accomplish our goals.,0,0,0,I cooperate toward shared goals.,0.7856293,0
747,Collaboration,I join forces with my team to reach shared objectives.,0,0,0,I cooperate toward shared goals.,0.81910753,0
748,Collaboration,I support group efforts to achieve common aims.,1,0,0,I cooperate toward shared goals.,0.74450886,0
749,Collaboration,I work in harmony with others to reach mutual goals.,0,0,0,I cooperate toward shared goals.,0.8080585,0
750,Collaboration,I assist in teamwork to achieve our common objectives.,0,0,0,I cooperate toward shared goals.,0.82198554,0
751,Trust Building,I gain the trust of other people.,0,0,0,I earn others’ confidence.,0.7972878,0
752,Trust Building,I build confidence in those around me.,0,0,0,I earn others’ confidence.,0.8706193,0
753,Trust Building,I inspire trust in others.,0,0,0,I earn others’ confidence.,0.86175025,0
754,Trust Building,I make others feel confident in me.,0,0,0,I earn others’ confidence.,0.85243475,0
755,Trust Building,I establish trust with people.,0,0,0,I earn others’ confidence.,0.8063632,0
756,Trust Building,I win the confidence of others.,0,0,0,I earn others’ confidence.,0.9087516,0
757,Trust Building,I develop trust with others.,0,0,0,I earn others’ confidence.,0.7904721,0
758,Trust Building,I earn people's trust.,0,0,0,I earn others’ confidence.,0.8639182,0
759,Trust Building,I create a sense of trust with others.,0,0,0,I earn others’ confidence.,0.7937344,0
760,Trust Building,I foster confidence in others.,0,0,0,I earn others’ confidence.,0.91868484,0
761,Trust Building,I have the trust of the people around me.,1,0,0,I earn others’ confidence.,0.64335436,0
762,Trust Building,I am trusted by others.,1,0,0,I earn others’ confidence.,0.6894336,0
763,Trust Building,I instill confidence in people.,0,0,0,I earn others’ confidence.,0.8985683,0
764,Trust Building,I achieve the trust of others.,0,0,0,I earn others’ confidence.,0.8253618,0
765,Trust Building,I secure the trust of others.,0,0,0,I earn others’ confidence.,0.78008246,0
766,Trust Building,I am someone others trust.,0,0,0,I earn others’ confidence.,0.7566609,0
767,Trust Building,I gain people's confidence.,0,0,0,I earn others’ confidence.,0.9146522,0
768,Trust Building,I inspire confidence in those around me.,0,0,0,I earn others’ confidence.,0.87851006,0
769,Trust Building,I am trusted by people.,1,0,0,I earn others’ confidence.,0.6548507,0
770,Trust Building,I create confidence in others.,0,0,0,I earn others’ confidence.,0.9153767,0
771,Trust Building,I have gained the trust of others.,1,0,0,I earn others’ confidence.,0.7302951,0
772,Trust Building,I earn the trust of those I meet.,0,0,0,I earn others’ confidence.,0.78209436,0
773,Trust Building,I make people feel they can trust me.,0,0,0,I earn others’ confidence.,0.7982986,0
774,Trust Building,I am seen as trustworthy by others.,1,0,0,I earn others’ confidence.,0.70516014,0
775,Trust Building,I cultivate confidence in others.,0,0,0,I earn others’ confidence.,0.91496754,0
776,Trust Building,I have earned confidence from others.,0,0,0,I earn others’ confidence.,0.7590678,0
777,Trust Building,I am someone people can trust.,1,0,0,I earn others’ confidence.,0.7345812,0
778,Trust Building,I build a trustful relationship with others.,0,0,0,I earn others’ confidence.,0.78049624,0
779,Inclusiveness,I appreciate hearing different opinions.,0,0,0,I welcome diverse viewpoints.,0.75060266,0
780,Inclusiveness,I enjoy listening to various points of view.,1,0,0,I welcome diverse viewpoints.,0.695669,0
781,Inclusiveness,I like considering different perspectives.,1,0,0,I welcome diverse viewpoints.,0.71352565,0
782,Inclusiveness,I accept ideas from different people.,1,0,0,I welcome diverse viewpoints.,0.5424073,0
783,Inclusiveness,I am open to different opinions.,0,0,0,I welcome diverse viewpoints.,0.78539467,0
784,Inclusiveness,I value hearing new viewpoints.,1,0,0,I welcome diverse viewpoints.,0.74288416,0
785,Inclusiveness,I enjoy discussing various ideas.,1,0,0,I welcome diverse viewpoints.,0.5026253,0
786,Inclusiveness,I am interested in different perspectives.,1,0,0,I welcome diverse viewpoints.,0.59733725,0
787,Inclusiveness,I embrace different ways of thinking.,1,0,0,I welcome diverse viewpoints.,0.60799026,0
788,Inclusiveness,I appreciate diverse opinions.,0,0,0,I welcome diverse viewpoints.,0.85470206,0
789,Inclusiveness,I enjoy learning from different viewpoints.,1,0,0,I welcome diverse viewpoints.,0.5953008,0
790,Inclusiveness,I am curious about other perspectives.,1,0,0,I welcome diverse viewpoints.,0.7007153,0
791,Inclusiveness,I respect different opinions.,1,0,0,I welcome diverse viewpoints.,0.60616213,0
792,Inclusiveness,I appreciate diverse points of view.,0,0,0,I welcome diverse viewpoints.,0.9107493,0
793,Inclusiveness,I listen to various perspectives.,1,0,0,I welcome diverse viewpoints.,0.56331134,0
794,Inclusiveness,I value diverse opinions.,1,0,0,I welcome diverse viewpoints.,0.7055341,0
795,Inclusiveness,I am open to hearing new ideas.,1,0,0,I welcome diverse viewpoints.,0.51073563,0
796,Inclusiveness,I appreciate different ways of thinking.,1,0,0,I welcome diverse viewpoints.,0.6386329,0
797,Inclusiveness,I welcome new opinions.,1,0,0,I welcome diverse viewpoints.,0.71579814,0
798,Inclusiveness,I enjoy understanding various viewpoints.,1,0,0,I welcome diverse viewpoints.,0.64010453,0
799,Inclusiveness,I am interested in hearing different ideas.,1,0,0,I welcome diverse viewpoints.,0.5766764,0
800,Inclusiveness,I value listening to others' perspectives.,1,0,0,I welcome diverse viewpoints.,0.6698954,0
801,Inclusiveness,I am open to diverse thoughts.,0,0,0,I welcome diverse viewpoints.,0.857236,0
802,Inclusiveness,I enjoy considering other people's viewpoints.,1,0,0,I welcome diverse viewpoints.,0.6806567,0
803,Inclusiveness,I appreciate hearing new perspectives.,0,0,0,I welcome diverse viewpoints.,0.78638566,0
804,Inclusiveness,I welcome hearing different ideas.,1,0,0,I welcome diverse viewpoints.,0.667521,0
805,Inclusiveness,I like exploring different opinions.,1,0,0,I welcome diverse viewpoints.,0.6685679,0
806,Inclusiveness,I enjoy learning about diverse viewpoints.,1,0,0,I welcome diverse viewpoints.,0.64470124,0
807,Mentorship,I support people in learning new skills.,0,0,0,I help others develop skills.,0.83208925,0
808,Mentorship,I assist others in building their abilities.,0,0,0,I help others develop skills.,0.8816505,0
809,Mentorship,I guide others to improve their skills.,0,0,0,I help others develop skills.,0.8707999,0
810,Mentorship,I coach people to enhance their skills.,0,0,0,I help others develop skills.,0.82815355,0
811,Mentorship,I encourage others to develop their abilities.,1,0,0,I help others develop skills.,0.6429908,0
812,Mentorship,I help others to learn new skills.,0,0,0,I help others develop skills.,0.9530281,0
813,Mentorship,I aid people in improving their skills.,0,0,0,I help others develop skills.,0.9568471,0
814,Mentorship,I contribute to others' skill development.,0,0,0,I help others develop skills.,0.91327,0
815,Mentorship,I teach others to gain new skills.,0,0,0,I help others develop skills.,0.90538085,0
816,Mentorship,I facilitate skill growth in others.,0,0,0,I help others develop skills.,0.91509193,0
817,Mentorship,I mentor people in skill development.,0,0,0,I help others develop skills.,0.8713891,0
818,Mentorship,I lead others in developing new abilities.,1,0,0,I help others develop skills.,0.7409858,0
819,Mentorship,I foster skill advancement in others.,0,0,0,I help others develop skills.,0.8683185,0
820,Mentorship,I help individuals improve their skills.,0,0,0,I help others develop skills.,0.94381356,0
821,Mentorship,I enable others to acquire new skills.,0,0,0,I help others develop skills.,0.89846736,0
822,Mentorship,I play a role in others' skill building.,0,0,0,I help others develop skills.,0.897241,0
823,Mentorship,I assist people in enhancing their skills.,0,0,0,I help others develop skills.,0.94104254,0
824,Mentorship,I offer support in skill development.,0,0,0,I help others develop skills.,0.8082249,0
825,Mentorship,I inspire others to develop their skills.,0,0,0,I help others develop skills.,0.81775916,0
826,Mentorship,I help others master new skills.,0,0,0,I help others develop skills.,0.9310087,0
827,Mentorship,I empower others to improve their skills.,0,0,0,I help others develop skills.,0.86324865,0
828,Mentorship,I participate in skill-building activities for others.,0,0,0,I help others develop skills.,0.8984926,0
829,Mentorship,I encourage skill growth in others.,1,0,0,I help others develop skills.,0.7316835,0
830,Mentorship,I help people to develop their abilities.,0,0,0,I help others develop skills.,0.910853,0
831,Mentorship,I guide individuals in learning new skills.,0,0,0,I help others develop skills.,0.8379184,0
832,Mentorship,I provide help for others to gain skills.,0,0,0,I help others develop skills.,0.9408689,0
833,Mentorship,I help others to enhance their abilities.,0,0,0,I help others develop skills.,0.8827517,0
834,Mentorship,I assist in others' skill improvement.,0,0,0,I help others develop skills.,0.9334322,0
835,Persuasion,I am able to persuade people to accept my viewpoints.,0,0,0,I can convince others of my ideas.,0.850299,0
836,Persuasion,I have the ability to get others to agree with me.,0,0,0,I can convince others of my ideas.,0.795261,0
837,Persuasion,I can make people see things from my perspective.,1,0,0,I can convince others of my ideas.,0.7399919,0
838,Persuasion,I am successful in getting my ideas across to others.,0,0,0,I can convince others of my ideas.,0.7533605,0
839,Persuasion,I can effectively argue my point of view.,1,0,0,I can convince others of my ideas.,0.63344234,0
840,Persuasion,I have the skill to convince people of my opinions.,0,0,0,I can convince others of my ideas.,0.79328966,0
841,Persuasion,I can communicate my ideas in a way that others understand.,0,0,0,I can convince others of my ideas.,0.8175364,0
842,Persuasion,I am capable of influencing others with my thoughts.,0,0,0,I can convince others of my ideas.,0.8317251,0
843,Persuasion,I can present my ideas in a convincing manner.,0,0,0,I can convince others of my ideas.,0.84705293,0
844,Persuasion,I successfully share my thoughts with others.,1,0,0,I can convince others of my ideas.,0.69502044,0
845,Persuasion,I can talk to others and get them to see my side.,0,0,0,I can convince others of my ideas.,0.76164275,0
846,Persuasion,I am proficient at explaining my ideas to others.,0,0,0,I can convince others of my ideas.,0.8310533,0
847,Persuasion,I am good at making my ideas clear to others.,0,0,0,I can convince others of my ideas.,0.8030952,0
848,Persuasion,I can express my thoughts in a way that persuades others.,0,0,0,I can convince others of my ideas.,0.8636375,0
849,Persuasion,I can get others to consider my ideas seriously.,0,0,0,I can convince others of my ideas.,0.9083093,0
850,Persuasion,I am able to influence others with my arguments.,0,0,0,I can convince others of my ideas.,0.8295505,0
851,Persuasion,I can communicate my thoughts in a way that convinces people.,0,0,0,I can convince others of my ideas.,0.8406487,0
852,Persuasion,I am skilled at presenting my ideas to others effectively.,0,0,0,I can convince others of my ideas.,0.78640723,0
853,Persuasion,I can make others understand and accept my ideas.,0,0,0,I can convince others of my ideas.,0.8979124,0
854,Persuasion,I can persuade others to agree with my opinions.,0,0,0,I can convince others of my ideas.,0.87807566,0
855,Persuasion,I have the confidence to share my ideas with others.,1,0,0,I can convince others of my ideas.,0.6985158,0
856,Persuasion,I can express my opinions in a way that others find convincing.,0,0,0,I can convince others of my ideas.,0.8513235,0
857,Persuasion,I am effective at getting others to listen to my ideas.,0,0,0,I can convince others of my ideas.,0.79549056,0
858,Persuasion,I can influence others to see my point of view.,0,0,0,I can convince others of my ideas.,0.7925813,0
859,Persuasion,I am able to make others understand my perspective.,0,0,0,I can convince others of my ideas.,0.7724184,0
860,Persuasion,I can articulate my ideas so others agree with them.,0,0,0,I can convince others of my ideas.,0.8769524,0
861,Persuasion,I have the ability to present my ideas convincingly.,0,0,0,I can convince others of my ideas.,0.81905794,0
862,Persuasion,I can demonstrate my ideas in a way that persuades others.,0,0,0,I can convince others of my ideas.,0.89061487,0
863,Storytelling,I use stories to explain my ideas.,0,0,0,I explain ideas through stories.,0.9156122,0
864,Storytelling,I tell stories to communicate my thoughts.,0,0,0,I explain ideas through stories.,0.76294756,0
865,Storytelling,I share my ideas through storytelling.,0,0,0,I explain ideas through stories.,0.88147765,0
866,Storytelling,I convey my thoughts using stories.,0,0,0,I explain ideas through stories.,0.86044824,0
867,Storytelling,I present my ideas by telling stories.,0,0,0,I explain ideas through stories.,0.9143,0
868,Storytelling,I use narratives to explain my ideas.,0,0,0,I explain ideas through stories.,0.8489245,0
869,Storytelling,I describe ideas with stories.,0,0,0,I explain ideas through stories.,0.91127384,0
870,Storytelling,I express my ideas through storytelling.,0,0,0,I explain ideas through stories.,0.8668111,0
871,Storytelling,I illustrate my thoughts by telling stories.,0,0,0,I explain ideas through stories.,0.85181755,0
872,Storytelling,I use storytelling to share my ideas.,0,0,0,I explain ideas through stories.,0.8368529,0
873,Storytelling,I tell stories to express my ideas.,0,0,0,I explain ideas through stories.,0.8154677,0
874,Storytelling,I use stories to convey my thoughts.,0,0,0,I explain ideas through stories.,0.81149244,0
875,Storytelling,I communicate ideas with stories.,0,0,0,I explain ideas through stories.,0.89085895,0
876,Storytelling,I explain my thoughts through storytelling.,0,0,0,I explain ideas through stories.,0.8664496,0
877,Storytelling,I share my thoughts by telling stories.,0,0,0,I explain ideas through stories.,0.76976085,0
878,Storytelling,I use stories to describe my ideas.,0,0,0,I explain ideas through stories.,0.8531311,0
879,Storytelling,I present my thoughts using stories.,0,0,0,I explain ideas through stories.,0.85883576,0
880,Storytelling,I express thoughts by telling stories.,0,0,0,I explain ideas through stories.,0.80092967,0
881,Storytelling,I communicate my ideas through stories.,0,0,0,I explain ideas through stories.,0.8998634,0
882,Storytelling,I explain concepts using stories.,0,0,0,I explain ideas through stories.,0.9317033,0
883,Storytelling,I tell stories to describe my ideas.,0,0,0,I explain ideas through stories.,0.87655,0
884,Storytelling,I use storytelling to convey my thoughts.,0,0,0,I explain ideas through stories.,0.797662,0
885,Storytelling,I express ideas by telling stories.,0,0,0,I explain ideas through stories.,0.8936214,0
886,Storytelling,I share ideas through storytelling.,0,0,0,I explain ideas through stories.,0.8884353,0
887,Storytelling,I use narratives to communicate my thoughts.,0,0,0,I explain ideas through stories.,0.76445675,0
888,Storytelling,I illustrate ideas with stories.,0,0,0,I explain ideas through stories.,0.90635085,0
889,Storytelling,I tell stories to share my thoughts.,1,0,0,I explain ideas through stories.,0.6618589,0
890,Storytelling,I describe thoughts using stories.,0,0,0,I explain ideas through stories.,0.7955318,0
891,Confidence,I show confidence in my actions.,1,0,0,I project self-assurance.,0.6752201,0
892,Confidence,I appear sure of myself.,1,0,0,I project self-assurance.,0.63144594,0
893,Confidence,I convey a sense of confidence.,1,0,0,I project self-assurance.,0.6896348,0
894,Confidence,I express self-confidence in my behavior.,1,0,0,I project self-assurance.,0.731954,0
895,Confidence,I demonstrate assurance in my demeanor.,1,0,0,I project self-assurance.,0.6872771,0
896,Confidence,I act with self-assurance.,1,0,0,I project self-assurance.,0.74703693,0
897,Confidence,I have a confident presence.,1,0,0,I project self-assurance.,0.6202078,0
898,Confidence,I seem self-assured to others.,1,0,0,I project self-assurance.,0.7356771,0
899,Confidence,I carry myself confidently.,1,0,0,I project self-assurance.,0.6092092,0
900,Confidence,I give off a confident vibe.,1,0,0,I project self-assurance.,0.55863106,0
901,Confidence,I exude self-confidence.,1,0,0,I project self-assurance.,0.702746,0
902,Confidence,I present myself with assurance.,1,0,0,I project self-assurance.,0.70124054,0
903,Confidence,I maintain a confident attitude.,1,0,0,I project self-assurance.,0.65492857,0
904,Confidence,I display confidence in my interactions.,1,0,0,I project self-assurance.,0.68387604,0
905,Confidence,I radiate self-assurance.,1,0,0,I project self-assurance.,0.72774255,0
906,Confidence,I possess a confident manner.,1,0,0,I project self-assurance.,0.6363019,0
907,Confidence,I reflect confidence in my gestures.,1,0,0,I project self-assurance.,0.5690939,0
908,Confidence,I behave with self-assurance.,0,0,0,I project self-assurance.,0.7583471,0
909,Confidence,I show assurance in my speech.,1,0,0,I project self-assurance.,0.67963666,0
910,Confidence,I project a confident image.,0,0,0,I project self-assurance.,0.8020199,0
911,Confidence,I reveal confidence in my approach.,1,0,0,I project self-assurance.,0.63158345,0
912,Confidence,I come across as self-assured.,1,0,0,I project self-assurance.,0.6557443,0
913,Confidence,I exhibit confidence naturally.,1,0,0,I project self-assurance.,0.6831136,0
914,Confidence,I have a self-assured style.,1,0,0,I project self-assurance.,0.7277975,0
915,Confidence,I communicate confidence in my words.,1,0,0,I project self-assurance.,0.59781706,0
916,Confidence,I express assurance in my actions.,1,0,0,I project self-assurance.,0.672413,0
917,Confidence,I demonstrate confidence in my choices.,1,0,0,I project self-assurance.,0.6601889,0
918,Confidence,I embody a confident attitude.,1,0,0,I project self-assurance.,0.667151,0
919,Energising,I boost the team's spirits.,0,0,0,I lift group morale.,0.8152559,0
920,Energising,I help the group feel more positive.,0,0,0,I lift group morale.,0.8706656,0
921,Energising,I encourage my team to stay motivated.,1,0,0,I lift group morale.,0.63263804,0
922,Energising,I bring a positive attitude to the group.,0,0,0,I lift group morale.,0.77825093,0
923,Energising,I make sure everyone feels good in the team.,1,0,0,I lift group morale.,0.7015191,0
924,Energising,I inspire my colleagues to stay upbeat.,1,0,0,I lift group morale.,0.6929978,0
925,Energising,I support the team's morale.,1,0,0,I lift group morale.,0.597145,0
926,Energising,I create a positive atmosphere in the group.,0,0,0,I lift group morale.,0.78496456,0
927,Energising,I help lift the team's mood.,0,0,0,I lift group morale.,0.7927575,0
928,Energising,I encourage a positive vibe in the team.,1,0,0,I lift group morale.,0.6306272,0
929,Energising,I keep the group's energy high.,1,0,0,I lift group morale.,0.7274334,0
930,Energising,I cheer up my teammates.,1,0,0,I lift group morale.,0.7025663,0
931,Energising,I help my group feel encouraged.,0,0,0,I lift group morale.,0.8133386,0
932,Energising,I make the team feel more optimistic.,1,0,0,I lift group morale.,0.6945814,0
933,Energising,I help my team stay cheerful.,0,0,0,I lift group morale.,0.77634144,0
934,Energising,I bring enthusiasm to the group.,0,0,0,I lift group morale.,0.7688327,0
935,Energising,I improve the team's morale.,0,0,0,I lift group morale.,0.85998523,0
936,Energising,I uplift the group's spirit.,0,0,0,I lift group morale.,0.8467489,0
937,Energising,I help my team feel more confident.,0,0,0,I lift group morale.,0.7592627,0
938,Energising,I energize the group with positivity.,0,0,0,I lift group morale.,0.7501587,0
939,Energising,I raise the team's morale.,0,0,0,I lift group morale.,0.8646288,0
940,Energising,I motivate my group to stay positive.,0,0,0,I lift group morale.,0.81120694,0
941,Energising,I enhance the group's spirit.,0,0,0,I lift group morale.,0.8469032,0
942,Energising,I help the team stay motivated.,1,0,0,I lift group morale.,0.73084956,0
943,Energising,I promote a good mood in the team.,1,0,0,I lift group morale.,0.72589445,0
944,Energising,I keep the team's spirits high.,1,0,0,I lift group morale.,0.7287098,0
945,Energising,I bring encouragement to the group.,0,0,0,I lift group morale.,0.8431964,0
946,Energising,I foster a positive spirit in the team.,1,0,0,I lift group morale.,0.7442999,0
947,Negotiation,I make agreements that make everyone happy.,0,0,0,I reach deals that satisfy all sides.,0.863486,0
948,Negotiation,I negotiate deals that are fair for everyone.,0,0,0,I reach deals that satisfy all sides.,0.86068237,0
949,Negotiation,I create solutions that please all parties.,0,0,0,I reach deals that satisfy all sides.,0.7999197,0
950,Negotiation,I find compromises that satisfy everyone involved.,1,0,0,I reach deals that satisfy all sides.,0.71980524,0
951,Negotiation,I settle arrangements that work for all sides.,0,0,0,I reach deals that satisfy all sides.,0.7941154,0
952,Negotiation,I develop agreements that everyone agrees with.,0,0,0,I reach deals that satisfy all sides.,0.8165751,0
953,Negotiation,I come to decisions that suit everyone.,1,0,0,I reach deals that satisfy all sides.,0.66307205,0
954,Negotiation,I ensure deals meet everyone's needs.,0,0,0,I reach deals that satisfy all sides.,0.7765194,0
955,Negotiation,I arrange agreements that benefit all involved.,0,0,0,I reach deals that satisfy all sides.,0.8178204,0
956,Negotiation,I achieve outcomes that all parties like.,0,0,0,I reach deals that satisfy all sides.,0.7695017,0
957,Negotiation,I craft deals that make everyone satisfied.,1,0,0,I reach deals that satisfy all sides.,0.69271564,0
958,Negotiation,I organize agreements that everyone supports.,0,0,0,I reach deals that satisfy all sides.,0.75801647,0
959,Negotiation,I reach solutions that all sides appreciate.,0,0,0,I reach deals that satisfy all sides.,0.81241286,0
960,Negotiation,I establish deals that everyone finds acceptable.,0,0,0,I reach deals that satisfy all sides.,0.8659146,0
961,Negotiation,I finalize agreements that leave everyone content.,0,0,0,I reach deals that satisfy all sides.,0.79318666,0
962,Negotiation,I conclude negotiations with everyone's satisfaction in mind.,1,0,0,I reach deals that satisfy all sides.,0.73251367,0
963,Negotiation,I secure deals that are good for all parties.,0,0,0,I reach deals that satisfy all sides.,0.81607306,0
964,Negotiation,I work out arrangements that satisfy every side.,1,0,0,I reach deals that satisfy all sides.,0.6104796,0
965,Negotiation,I get results that all parties are happy with.,1,0,0,I reach deals that satisfy all sides.,0.7186767,0
966,Negotiation,I manage to make agreements that everyone is pleased with.,0,0,0,I reach deals that satisfy all sides.,0.8555627,0
967,Negotiation,I produce outcomes that satisfy everyone involved.,0,0,0,I reach deals that satisfy all sides.,0.7789508,0
968,Negotiation,I strike deals that are satisfactory for all sides.,0,0,0,I reach deals that satisfy all sides.,0.9560392,0
969,Negotiation,I accomplish agreements that everyone can agree on.,0,0,0,I reach deals that satisfy all sides.,0.832488,0
970,Negotiation,I navigate deals that keep everyone satisfied.,0,0,0,I reach deals that satisfy all sides.,0.7952914,0
971,Negotiation,I handle negotiations that result in mutual satisfaction.,0,0,0,I reach deals that satisfy all sides.,0.8153366,0
