,facet,stem_text,drift_flag,readability_flag,length_flag,anchor,cosine_similarity,lenght_flag
478,Efficiency,I finish my projects rapidly.,1,0,0,I finish tasks in less time.,0.68567926,0
479,Efficiency,I complete tasks faster than expected.,0,0,0,I finish tasks in less time.,0.75769055,0
480,Efficiency,I quickly finish what I start.,1,0,0,I finish tasks in less time.,0.5285486,0
481,Efficiency,I efficiently complete my assignments.,1,0,0,I finish tasks in less time.,0.62345135,0
482,Efficiency,I do my jobs in a shorter time.,0,0,0,I finish tasks in less time.,0.7543806,0
483,Efficiency,I complete my tasks with speed.,1,0,0,I finish tasks in less time.,0.7130422,0
484,Efficiency,I accomplish my work in a brief time.,1,0,0,I finish tasks in less time.,0.6566846,0
485,Efficiency,I finalize my tasks quickly.,0,0,0,I finish tasks in less time.,0.78168845,0
486,Efficiency,I finish my assignments in a short period.,1,0,0,I finish tasks in less time.,0.6501443,0
487,Efficiency,I do my duties in less time.,0,0,0,I finish tasks in less time.,0.7737159,0
488,Efficiency,I end my work swiftly.,1,0,0,I finish tasks in less time.,0.6154657,0
489,Efficiency,I complete my jobs promptly.,1,0,0,I finish tasks in less time.,0.63185596,0
490,Efficiency,I work through tasks at a fast pace.,0,0,0,I finish tasks in less time.,0.78413975,0
491,Efficiency,I finish my work earlier than planned.,1,0,0,I finish tasks in less time.,0.6237402,0
492,Efficiency,I handle my jobs efficiently.,1,0,0,I finish tasks in less time.,0.5950508,0
493,Efficiency,I complete my duties rapidly.,1,0,0,I finish tasks in less time.,0.6272235,0
494,Efficiency,I achieve my tasks in a short time.,0,0,0,I finish tasks in less time.,0.822907,0
495,Efficiency,I perform my work quickly.,1,0,0,I finish tasks in less time.,0.69468695,0
496,Efficiency,I finish tasks with speed.,0,0,0,I finish tasks in less time.,0.7839934,0
497,Efficiency,I complete tasks in a shorter time.,0,0,0,I finish tasks in less time.,0.9271962,0
498,Efficiency,I accomplish my assignments swiftly.,1,0,0,I finish tasks in less time.,0.5440438,0
499,Efficiency,I end my tasks in less time.,0,0,0,I finish tasks in less time.,0.92580134,0
500,Responsibility,I am responsible for the results of my work.,1,0,0,I own the outcomes of my work.,0.7176026,0
501,Responsibility,I take charge of the outcomes of my work.,0,0,0,I own the outcomes of my work.,0.7994789,0
502,Responsibility,I handle the results of my work.,1,0,0,I own the outcomes of my work.,0.7439718,0
503,Responsibility,I am accountable for what comes from my work.,1,0,0,I own the outcomes of my work.,0.58348143,0
504,Responsibility,I manage the results of my work.,1,0,0,I own the outcomes of my work.,0.7224011,0
505,Responsibility,I take responsibility for my work outcomes.,1,0,0,I own the outcomes of my work.,0.7439109,0
506,Responsibility,I am in charge of the results of my work.,1,0,0,I own the outcomes of my work.,0.6644688,0
507,Responsibility,I am answerable for the outcomes of my work.,1,0,0,I own the outcomes of my work.,0.64870393,0
508,Responsibility,I control the results of my work.,1,0,0,I own the outcomes of my work.,0.72536874,0
509,Responsibility,I deal with the outcomes of my work.,0,0,0,I own the outcomes of my work.,0.8358358,0
510,Responsibility,I am in control of my work outcomes.,1,0,0,I own the outcomes of my work.,0.6975827,0
511,Responsibility,I ensure the results of my work are mine.,1,0,0,I own the outcomes of my work.,0.6604727,0
512,Responsibility,I am responsible for what happens with my work.,1,0,0,I own the outcomes of my work.,0.6985879,0
513,Responsibility,I oversee the results of my work.,1,0,0,I own the outcomes of my work.,0.6621487,0
514,Responsibility,I accept the outcomes of my work.,0,0,0,I own the outcomes of my work.,0.81137,0
515,Responsibility,I look after the results of my work.,1,0,0,I own the outcomes of my work.,0.54172933,0
516,Responsibility,I direct the outcomes of my work.,0,0,0,I own the outcomes of my work.,0.8530578,0
517,Responsibility,I am in charge of what my work produces.,1,0,0,I own the outcomes of my work.,0.56124294,0
518,Responsibility,I manage what results from my work.,1,0,0,I own the outcomes of my work.,0.6798184,0
519,Responsibility,I am the owner of my work outcomes.,0,0,0,I own the outcomes of my work.,0.87862074,0
520,Responsibility,I see the results of my work as my responsibility.,1,0,0,I own the outcomes of my work.,0.71610034,0
521,Responsibility,I am answerable for the results of my work.,1,0,0,I own the outcomes of my work.,0.3665499,0
522,Responsibility,I own the results that come from my work.,1,0,0,I own the outcomes of my work.,0.7179252,0
523,Responsibility,I am responsible for the effects of my work.,1,0,0,I own the outcomes of my work.,0.6731501,0
524,Responsibility,I control the outcomes that come from my work.,0,0,0,I own the outcomes of my work.,0.8152618,0
525,Responsibility,I am accountable for the results of my work.,1,0,0,I own the outcomes of my work.,0.6133139,0
526,Responsibility,I take ownership of what results from my work.,0,0,0,I own the outcomes of my work.,0.7509095,0
527,Responsibility,I am the one who deals with my work outcomes.,0,0,0,I own the outcomes of my work.,0.7971798,0
528,Ethics,I live in a way that matches my beliefs.,1,0,0,I act according to my values.,0.4124781,0
529,Ethics,I make decisions based on my principles.,1,0,0,I act according to my values.,0.5811813,0
530,Ethics,I follow my personal values in my actions.,0,0,0,I act according to my values.,0.8141834,0
531,Ethics,I behave in a way that reflects my values.,0,0,0,I act according to my values.,0.84139824,0
532,Ethics,I choose actions that align with what I believe.,1,0,0,I act according to my values.,0.59791803,0
533,Ethics,I stay true to my values in how I act.,0,0,0,I act according to my values.,0.8543929,0
534,Ethics,I act in line with my principles.,1,0,0,I act according to my values.,0.6804404,0
535,Ethics,I make choices that fit my values.,1,0,0,I act according to my values.,0.68625003,0
536,Ethics,I live according to what I believe is right.,1,0,0,I act according to my values.,0.4338408,0
537,Ethics,I let my values guide my actions.,1,0,0,I act according to my values.,0.7447861,0
538,Ethics,I act consistently with my beliefs.,1,0,0,I act according to my values.,0.69099516,0
539,Ethics,I follow my beliefs in daily life.,1,0,0,I act according to my values.,0.48712313,0
540,Ethics,I make choices that reflect my principles.,1,0,0,I act according to my values.,0.5310554,0
541,Ethics,I align my actions with my personal values.,0,0,0,I act according to my values.,0.7598778,0
542,Ethics,I live by my own set of values.,1,0,0,I act according to my values.,0.64238656,0
543,Ethics,I let my values influence my decisions.,1,0,0,I act according to my values.,0.6855136,0
544,Ethics,I act in accordance with what I believe.,1,0,0,I act according to my values.,0.70672494,0
545,Ethics,I choose to follow my values in life.,1,0,0,I act according to my values.,0.6779944,0
546,Ethics,I take actions that are based on my values.,0,0,0,I act according to my values.,0.82495916,0
547,Ethics,I stick to my values when I decide.,1,0,0,I act according to my values.,0.6953276,0
548,Ethics,I let my beliefs shape my actions.,1,0,0,I act according to my values.,0.5252152,0
549,Ethics,I stay aligned with my values in my actions.,1,0,0,I act according to my values.,0.6846601,0
550,Ethics,I follow my values in everything I do.,0,0,0,I act according to my values.,0.7723203,0
551,Ethics,I let my principles guide my behavior.,1,0,0,I act according to my values.,0.5674226,0
552,Ethics,I act in a way that aligns with my beliefs.,1,0,0,I act according to my values.,0.7028471,0
553,Ethics,I make decisions that are true to my values.,1,0,0,I act according to my values.,0.7147058,0
554,Ethics,I live my life according to my principles.,1,0,0,I act according to my values.,0.5627852,0
555,Ethics,I follow the values I believe in.,1,0,0,I act according to my values.,0.69558704,0
556,Reliability,I always meet my deadlines.,1,0,0,I deliver on time consistently.,0.53274214,0
557,Reliability,I am always punctual with my deliveries.,1,0,0,I deliver on time consistently.,0.66503555,0
558,Reliability,I consistently finish my tasks on schedule.,1,0,0,I deliver on time consistently.,0.6103277,0
559,Reliability,I make sure to deliver everything on time.,1,0,0,I deliver on time consistently.,0.7380192,0
560,Reliability,I stick to my deadlines every time.,1,0,0,I deliver on time consistently.,0.5468644,0
561,Reliability,I regularly deliver my work punctually.,1,0,0,I deliver on time consistently.,0.7193601,0
562,Reliability,I ensure timely delivery in all my projects.,1,0,0,I deliver on time consistently.,0.60996675,0
563,Reliability,I am prompt in delivering my assignments.,1,0,0,I deliver on time consistently.,0.37268224,0
564,Reliability,I always complete my deliveries on time.,0,0,0,I deliver on time consistently.,0.79284364,0
565,Reliability,I am always on schedule with my deliveries.,1,0,0,I deliver on time consistently.,0.71468484,0
566,Reliability,I make sure to be on time with my work.,1,0,0,I deliver on time consistently.,0.4386918,0
567,Reliability,I consistently deliver my tasks when expected.,1,0,0,I deliver on time consistently.,0.7063966,0
568,Reliability,I always deliver my projects when required.,1,0,0,I deliver on time consistently.,0.5417752,0
569,Reliability,I meet my deadlines without delay.,1,0,0,I deliver on time consistently.,0.48427778,0
570,Reliability,I make timely deliveries in my work.,1,0,0,I deliver on time consistently.,0.72587603,0
571,Reliability,I always finish my tasks on time.,1,0,0,I deliver on time consistently.,0.5706361,0
572,Reliability,I deliver my assignments promptly.,1,0,0,I deliver on time consistently.,0.6369759,0
573,Reliability,I ensure all my deliveries are on time.,1,0,0,I deliver on time consistently.,0.7236099,0
574,Reliability,I am reliable with my delivery times.,0,0,0,I deliver on time consistently.,0.7589514,0
575,Reliability,I regularly meet all my deadlines.,1,0,0,I deliver on time consistently.,0.53827906,0
576,Reliability,I am consistent in delivering on schedule.,0,0,0,I deliver on time consistently.,0.76876456,0
577,Reliability,I always make sure my deliveries are punctual.,1,0,0,I deliver on time consistently.,0.6661495,0
578,Reliability,I complete my work on time every time.,1,0,0,I deliver on time consistently.,0.5521205,0
579,Reliability,I ensure my projects are delivered promptly.,1,0,0,I deliver on time consistently.,0.52961475,0
580,Reliability,I am dependable with my delivery times.,1,0,0,I deliver on time consistently.,0.6631955,0
581,Reliability,I always manage to deliver on time.,0,0,0,I deliver on time consistently.,0.87916577,0
582,Reliability,I keep up with my delivery schedule consistently.,0,0,0,I deliver on time consistently.,0.78325725,0
583,Reliability,I always fulfill my deadlines efficiently.,1,0,0,I deliver on time consistently.,0.62619126,0
584,Patience,I remain relaxed while waiting.,0,0,0,I stay calm when waiting.,0.81798834,0
585,Patience,I keep my cool when I have to wait.,1,0,0,I stay calm when waiting.,0.6954626,0
586,Patience,I feel composed when I am waiting.,1,0,0,I stay calm when waiting.,0.6180315,0
587,Patience,I am patient when I wait.,1,0,0,I stay calm when waiting.,0.7492018,0
588,Patience,I do not get upset while waiting.,1,0,0,I stay calm when waiting.,0.71091306,0
589,Patience,I am calm when I have to wait.,0,0,0,I stay calm when waiting.,0.9136199,0
590,Patience,I stay composed during times of waiting.,1,0,0,I stay calm when waiting.,0.6675614,0
591,Patience,I keep calm as I wait.,0,0,0,I stay calm when waiting.,0.90264255,0
592,Patience,I maintain my calmness when waiting.,0,0,0,I stay calm when waiting.,0.9331269,0
593,Patience,I am at ease while waiting.,1,0,0,I stay calm when waiting.,0.6472973,0
594,Patience,I stay relaxed when I need to wait.,0,0,0,I stay calm when waiting.,0.7997635,0
595,Patience,I feel relaxed when I wait.,0,0,0,I stay calm when waiting.,0.77657914,0
596,Patience,I am not bothered by waiting.,1,0,0,I stay calm when waiting.,0.65720415,0
597,Patience,I keep a calm attitude while waiting.,0,0,0,I stay calm when waiting.,0.9119058,0
598,Patience,I manage to stay calm when waiting.,0,0,0,I stay calm when waiting.,0.95944655,0
599,Patience,I wait patiently without stress.,0,0,0,I stay calm when waiting.,0.7827772,0
600,Patience,I remain patient when I wait.,0,0,0,I stay calm when waiting.,0.7697885,0
601,Patience,I possess a calm demeanor while waiting.,0,0,0,I stay calm when waiting.,0.8490452,0
602,Patience,I handle waiting with calmness.,0,0,0,I stay calm when waiting.,0.9136587,0
603,Patience,I maintain my patience when waiting.,0,0,0,I stay calm when waiting.,0.81969035,0
604,Patience,I am serene when I wait.,1,0,0,I stay calm when waiting.,0.72346526,0
605,Patience,I am steady when I have to wait.,1,0,0,I stay calm when waiting.,0.7021293,0
606,Patience,I handle waiting peacefully.,1,0,0,I stay calm when waiting.,0.740638,0
607,Patience,I am tranquil while waiting.,1,0,0,I stay calm when waiting.,0.7222556,0
608,Patience,I keep a peaceful mind when waiting.,0,0,0,I stay calm when waiting.,0.80590814,0
609,Patience,I stay cool when I am waiting.,1,0,0,I stay calm when waiting.,0.73577046,0
610,Patience,I manage to stay composed while waiting.,1,0,0,I stay calm when waiting.,0.6680001,0
611,Organising,I organize my tasks and information well.,0,0,0,I keep tasks and data in order.,0.7837448,0
612,Organising,I make sure my work and data are organized.,0,0,0,I keep tasks and data in order.,0.7603637,0
613,Organising,I arrange my responsibilities and data neatly.,0,0,0,I keep tasks and data in order.,0.75590825,0
614,Organising,I keep my tasks and records organized.,0,0,0,I keep tasks and data in order.,0.8428636,0
615,Organising,I manage my tasks and information effectively.,1,0,0,I keep tasks and data in order.,0.728658,0
616,Organising,I keep my activities and data in order.,0,0,0,I keep tasks and data in order.,0.8670489,0
617,Organising,I maintain my tasks and information well.,0,0,0,I keep tasks and data in order.,0.7539475,0
618,Organising,I organize my work and data clearly.,0,0,0,I keep tasks and data in order.,0.7617847,0
619,Organising,I handle my tasks and data in an organized way.,0,0,0,I keep tasks and data in order.,0.8785151,0
620,Organising,I maintain order in my tasks and information.,0,0,0,I keep tasks and data in order.,0.8475835,0
621,Organising,I keep my duties and data orderly.,0,0,0,I keep tasks and data in order.,0.7700648,0
622,Organising,I ensure my tasks and data are well-organized.,0,0,0,I keep tasks and data in order.,0.8656506,0
623,Organising,I arrange my work and data systematically.,0,0,0,I keep tasks and data in order.,0.77673626,0
624,Organising,I keep everything in order with my tasks and information.,0,0,0,I keep tasks and data in order.,0.89671266,0
625,Organising,I keep my activities and information organized.,1,0,0,I keep tasks and data in order.,0.7166197,0
626,Organising,I manage my duties and data efficiently.,0,0,0,I keep tasks and data in order.,0.75155234,0
627,Organising,I ensure my tasks and data are in order.,0,0,0,I keep tasks and data in order.,0.90016913,0
628,Organising,I organize my responsibilities and information well.,1,0,0,I keep tasks and data in order.,0.67227656,0
629,Organising,I keep my work and records organized.,1,0,0,I keep tasks and data in order.,0.6857133,0
630,Organising,I arrange my tasks and data clearly.,0,0,0,I keep tasks and data in order.,0.8620071,0
631,Organising,I make sure my tasks and information are tidy.,1,0,0,I keep tasks and data in order.,0.705871,0
632,Organising,I manage my activities and data in an orderly way.,0,0,0,I keep tasks and data in order.,0.79325676,0
633,Organising,I maintain my work and information neatly.,1,0,0,I keep tasks and data in order.,0.6982994,0
634,Organising,I make sure my responsibilities and data are organized.,1,0,0,I keep tasks and data in order.,0.6941681,0
635,Organising,I keep my duties and information in order.,1,0,0,I keep tasks and data in order.,0.697268,0
636,Organising,I arrange my activities and records systematically.,1,0,0,I keep tasks and data in order.,0.6975367,0
637,Organising,I handle my responsibilities and data well.,1,0,0,I keep tasks and data in order.,0.6921432,0
638,Organising,I keep my work and information in good order.,0,0,0,I keep tasks and data in order.,0.76163244,0
639,Safety Orientation,I try to prevent accidents from happening.,0,0,0,I take steps to avoid accidents.,0.81050074,0
640,Safety Orientation,I make sure to stay safe to avoid accidents.,0,0,0,I take steps to avoid accidents.,0.79619,0
641,Safety Orientation,I am careful to reduce the risk of accidents.,1,0,0,I take steps to avoid accidents.,0.68483174,0
642,Safety Orientation,I act to prevent accidents in my daily life.,0,0,0,I take steps to avoid accidents.,0.75577617,0
643,Safety Orientation,I ensure I am safe to avoid any accidents.,0,0,0,I take steps to avoid accidents.,0.7903042,0
644,Safety Orientation,I practice safety to prevent accidents.,1,0,0,I take steps to avoid accidents.,0.7298913,0
645,Safety Orientation,I make an effort to avoid accidents.,0,0,0,I take steps to avoid accidents.,0.86096656,0
646,Safety Orientation,I take actions to prevent accidents from occurring.,0,0,0,I take steps to avoid accidents.,0.7961795,0
647,Safety Orientation,I do my best to stay away from accidents.,0,0,0,I take steps to avoid accidents.,0.7556231,0
648,Safety Orientation,I follow safety measures to avoid accidents.,0,0,0,I take steps to avoid accidents.,0.8186436,0
649,Safety Orientation,I take precautions to keep accidents away.,0,0,0,I take steps to avoid accidents.,0.8260847,0
650,Safety Orientation,I use care to prevent accidents in my activities.,1,0,0,I take steps to avoid accidents.,0.63026375,0
651,Safety Orientation,I aim to avoid accidents in everything I do.,0,0,0,I take steps to avoid accidents.,0.8066325,0
652,Safety Orientation,I adopt safe practices to prevent accidents.,0,0,0,I take steps to avoid accidents.,0.75996256,0
653,Safety Orientation,I focus on safety to avoid accidents.,0,0,0,I take steps to avoid accidents.,0.77728134,0
654,Safety Orientation,I take care to prevent accidents during my tasks.,1,0,0,I take steps to avoid accidents.,0.74000317,0
655,Safety Orientation,I watch out for risks to avoid accidents.,1,0,0,I take steps to avoid accidents.,0.7110008,0
656,Safety Orientation,I maintain safety to prevent accidents.,1,0,0,I take steps to avoid accidents.,0.7442435,0
657,Safety Orientation,I use caution to avoid accidents.,1,0,0,I take steps to avoid accidents.,0.7407812,0
658,Safety Orientation,I carry out actions that prevent accidents.,0,0,0,I take steps to avoid accidents.,0.8043567,0
659,Safety Orientation,I keep alert to avoid any accidents.,1,0,0,I take steps to avoid accidents.,0.6973355,0
660,Safety Orientation,I plan my actions to prevent accidents.,0,0,0,I take steps to avoid accidents.,0.7797228,0
661,Safety Orientation,I work to ensure I don't have accidents.,1,0,0,I take steps to avoid accidents.,0.73224914,0
662,Safety Orientation,I follow guidelines to stay free from accidents.,1,0,0,I take steps to avoid accidents.,0.71756077,0
663,Safety Orientation,I think ahead to avoid accidents.,1,0,0,I take steps to avoid accidents.,0.6630869,0
664,Safety Orientation,I use safe methods to prevent accidents.,0,0,0,I take steps to avoid accidents.,0.76609826,0
665,Safety Orientation,I make sure my actions don't lead to accidents.,0,0,0,I take steps to avoid accidents.,0.7673367,0
666,Safety Orientation,I take deliberate steps to prevent accidents.,0,0,0,I take steps to avoid accidents.,0.917853,0
667,Empathy,I understand how other people feel.,1,0,0,I feel others’ emotions.,0.5723477,0
668,Empathy,I sense the emotions of others.,0,0,0,I feel others’ emotions.,0.8360249,0
669,Empathy,I can tell what others are feeling.,1,0,0,I feel others’ emotions.,0.67930317,0
670,Empathy,I recognize the feelings of other people.,0,0,0,I feel others’ emotions.,0.773931,0
671,Empathy,I am aware of other people's emotions.,1,0,0,I feel others’ emotions.,0.73447096,0
672,Empathy,I notice how others are feeling.,1,0,0,I feel others’ emotions.,0.74515617,0
673,Empathy,I pick up on other people's emotions.,1,0,0,I feel others’ emotions.,0.739645,0
674,Empathy,I perceive the emotions of others.,0,0,0,I feel others’ emotions.,0.86804605,0
675,Empathy,I am sensitive to how others feel.,1,0,0,I feel others’ emotions.,0.7018889,0
676,Empathy,I connect with the emotions of others.,1,0,0,I feel others’ emotions.,0.7165044,0
677,Empathy,I empathize with other people's feelings.,1,0,0,I feel others’ emotions.,0.72022235,0
678,Empathy,I relate to the emotions of others.,0,0,0,I feel others’ emotions.,0.78709805,0
679,Empathy,I detect the feelings of other people.,1,0,0,I feel others’ emotions.,0.73996735,0
680,Empathy,I am in tune with others' emotions.,1,0,0,I feel others’ emotions.,0.7200715,0
681,Empathy,I grasp how others are feeling.,1,0,0,I feel others’ emotions.,0.69399613,0
682,Empathy,I feel the emotions of those around me.,0,0,0,I feel others’ emotions.,0.7541189,0
683,Empathy,I comprehend the feelings of others.,1,0,0,I feel others’ emotions.,0.70773363,0
684,Empathy,I identify with other people's emotions.,0,0,0,I feel others’ emotions.,0.8053942,0
685,Empathy,I experience the emotions of others.,0,0,0,I feel others’ emotions.,0.8482648,0
686,Empathy,I am in touch with others' feelings.,1,0,0,I feel others’ emotions.,0.6358876,0
687,Empathy,I respond to other people's emotions.,1,0,0,I feel others’ emotions.,0.7256409,0
688,Empathy,I acknowledge how others are feeling.,1,0,0,I feel others’ emotions.,0.72212696,0
689,Empathy,I am receptive to other people's emotions.,0,0,0,I feel others’ emotions.,0.8151181,0
690,Empathy,I interpret the feelings of others.,1,0,0,I feel others’ emotions.,0.737562,0
691,Empathy,I read the emotions of other people.,1,0,0,I feel others’ emotions.,0.7409007,0
692,Empathy,I am mindful of others' emotions.,0,0,0,I feel others’ emotions.,0.77068365,0
693,Empathy,I pick up on what others feel.,1,0,0,I feel others’ emotions.,0.65810585,0
694,Empathy,I absorb the emotions of those around me.,1,0,0,I feel others’ emotions.,0.63870764,0
695,Social Awareness,I understand social signals well.,1,0,0,I read social cues accurately.,0.7039505,0
696,Social Awareness,I am good at picking up social cues.,1,0,0,I read social cues accurately.,0.732656,0
697,Social Awareness,I notice social hints quickly.,1,0,0,I read social cues accurately.,0.6052041,0
698,Social Awareness,I easily recognize social signs.,1,0,0,I read social cues accurately.,0.6413019,0
699,Social Awareness,I can read social gestures accurately.,0,0,0,I read social cues accurately.,0.8008187,0
700,Social Awareness,I am skilled at understanding social cues.,0,0,0,I read social cues accurately.,0.7905768,0
701,Social Awareness,I catch on to social signals fast.,1,0,0,I read social cues accurately.,0.63688576,0
702,Social Awareness,I interpret social cues correctly.,0,0,0,I read social cues accurately.,0.82881993,0
703,Social Awareness,I grasp social hints effectively.,1,0,0,I read social cues accurately.,0.66052926,0
704,Social Awareness,I am aware of social signals around me.,1,0,0,I read social cues accurately.,0.59787536,0
705,Social Awareness,I perceive social cues clearly.,0,0,0,I read social cues accurately.,0.8005927,0
706,Social Awareness,I identify social signs with ease.,1,0,0,I read social cues accurately.,0.6113994,0
707,Social Awareness,I am good at noticing social gestures.,1,0,0,I read social cues accurately.,0.63259983,0
708,Social Awareness,I understand the meaning of social signals.,1,0,0,I read social cues accurately.,0.6190005,0
709,Social Awareness,I can see social hints clearly.,1,0,0,I read social cues accurately.,0.63364375,0
710,Social Awareness,I am able to read social signs well.,1,0,0,I read social cues accurately.,0.7140956,0
711,Social Awareness,I pick up on social cues easily.,1,0,0,I read social cues accurately.,0.74596864,0
712,Social Awareness,I can spot social signals quickly.,1,0,0,I read social cues accurately.,0.649174,0
713,Social Awareness,I am adept at noticing social hints.,1,0,0,I read social cues accurately.,0.6774802,0
714,Social Awareness,I understand the meaning of social gestures.,1,0,0,I read social cues accurately.,0.5394957,0
715,Social Awareness,I read social signals with accuracy.,0,0,0,I read social cues accurately.,0.8352833,0
716,Social Awareness,I am aware of social gestures.,1,0,0,I read social cues accurately.,0.578964,0
717,Social Awareness,I detect social cues without difficulty.,0,0,0,I read social cues accurately.,0.7759361,0
718,Social Awareness,I am good at reading social hints.,1,0,0,I read social cues accurately.,0.65761626,0
719,Social Awareness,I comprehend social signals effortlessly.,1,0,0,I read social cues accurately.,0.6566124,0
720,Social Awareness,I can interpret social signs well.,1,0,0,I read social cues accurately.,0.6670232,0
721,Social Awareness,I am sensitive to social cues.,1,0,0,I read social cues accurately.,0.7003021,0
722,Social Awareness,I easily notice changes in social signals.,1,0,0,I read social cues accurately.,0.63344646,0
723,Collaboration,I work together with others to reach common goals.,0,0,0,I cooperate toward shared goals.,0.7894975,0
724,Collaboration,I join efforts with others to achieve shared objectives.,0,0,0,I cooperate toward shared goals.,0.83663595,0
725,Collaboration,I participate in teamwork to accomplish mutual aims.,0,0,0,I cooperate toward shared goals.,0.7811918,0
726,Collaboration,I collaborate with my team to fulfill our goals.,0,0,0,I cooperate toward shared goals.,0.78125596,0
